{
  "id": "01-sensitivity",
  "problem": "Sensitivity conjecture",
  "after_board": "Signed adjacency matrix with A^2 = nI, so squares add under product and the spectrum is flat at +-sqrt(n); Cauchy interlacing; lambda_1 <= Delta.",
  "multi_answer": false,
  "transformation": "auxiliary-witness-lift",
  "transformation_note": "Seed P3 also records that this case changes the product law from additive to Pythagorean, which is the evidence for the proposed 'product-law matching' replacement.",
  "source": "Huang, arXiv:1907.00847",
  "labelled_by": [
    "seed-chat-instance-2026-09-18"
  ],
  "label_pass": "v0-single-encoder-contaminated",
  "second_blind_label": null,
  "label_kappa": null,
  "level": {
    "axis": "same-level",
    "confidence": "high",
    "object_changed": "The board on the reduced object: counting and subcube refinement replaced by a signed adjacency matrix with A^2 = nI, Cauchy interlacing and lambda_1 <= Delta.",
    "what_stayed_fixed": "The object itself -- an induced subgraph of Q_n on 2^{n-1}+1 vertices -- is what both boards bound.",
    "basis": "THE STACK IS WORTH STATING: (sensitivity vs degree) <- (Gotsman-Linial 1992 reduction to induced-subgraph max degree) <- (the spectral tool Huang supplied). Huang changed the BOTTOM of that stack. The level crossing in this problem happened in 1992 and is baked into the item's state slot, which is why the 2019 change reads as same-level. NOW SOURCED, not recalled: Huang's concluding remarks say he confirms the Sensitivity Conjecture 'by proving its combinatorial equivalent formulation discovered by Gotsman and Linial', and the equivalence is his Theorem 1.3. So the stack is the paper's own framing, and the 2019 change sits at the bottom of it.",
    "assigned_by": "this session, single-encoder and unvalidated",
    "recorded_for": "debt D30; vocabulary in p3-taxonomy/taxonomy.json -> level_axis"
  }
}
